mysql> create table Hospital(patient_no int,patient_name varchar(30),Admitteddate date,dischargedate date);
Query OK, 0 rows affected (0.04 sec)

mysql> insert into hospital values(143,'deva','2022-09-19','2022-09-22'),(132,'jaya','2022-09-12','2022-09-20'),(143,'revanth','2022-09-21','2022-09-22');
Query OK, 3 rows affected (0.03 sec)
Records: 3  Duplicates: 0  Warnings: 0

mysql> select * from hospital;
+------------+--------------+--------------+---------------+
| patient_no | patient_name | Admitteddate | dischargedate |
+------------+--------------+--------------+---------------+
|        143 | deva         | 2022-09-19   | 2022-09-22    |
|        132 | jaya         | 2022-09-12   | 2022-09-20    |
|        143 | revanth      | 2022-09-21   | 2022-09-22    |
+------------+--------------+--------------+---------------+
3 rows in set (0.00 sec)

mysql> delete from hospital where patient_no=143;
Query OK, 2 rows affected (0.02 sec)

mysql> select* from hospital;
+------------+--------------+--------------+---------------+
| patient_no | patient_name | Admitteddate | dischargedate |
+------------+--------------+--------------+---------------+
|        132 | jaya         | 2022-09-12   | 2022-09-20    |
+------------+--------------+--------------+---------------+
1 row in set (0.00 sec)

mysql> update hospital set patient_no=123
    -> where patient_name ='deva';
Query OK, 0 rows affected (0.00 sec)
Rows matched: 0  Changed: 0  Warnings: 0

mysql> select* from hospital;
+------------+--------------+--------------+---------------+
| patient_no | patient_name | Admitteddate | dischargedate |
+------------+--------------+--------------+---------------+
|        132 | jaya         | 2022-09-12   | 2022-09-20    |
+------------+--------------+--------------+---------------+
1 row in set (0.00 sec)

mysql>